{
  "schema_version": 1,
  "packet_id": "wave_006_generic_runtime_objects_01",
  "scope": "generic_runtime_objects",
  "subsystem": {
    "name": "GenericRuntimeObjects",
    "responsibility": "Heterogeneous set of generic runtime objects and lifecycle primitives: a 2D-indexed 28-byte struct-array reader, block-memory copy and conditional-free helpers, Miles Sound System sample playback/positioning/processor objects (shared this+0x54/0x58/0x60/0x64/0x68 field cluster), vtable-swap destructors and synchronization teardown, three differently-based linked-list containers (string-unique list, view/projection list, mutex-slot list), a mutex lock object, camera-manager teardown, and per-frame scene-object/contact-mode dispatch. The strongest cross-function grouping is the Miles audio cluster (five functions sharing the sample-info pointer at this+0x58 and the listener pointer at this+0x54, connected by direct call edges); the three list-insert functions are kept as separate classes because their head/tail/first/count fields sit at different offsets (this+0x8/0xC/0x10/0x14 vs this+0x18/0x1C/0x20/0x24 vs this+0x28/0x2C/0x30/0x34).",
    "trust": "GUESS",
    "evidence_refs": [
      "function:0x00403FC0",
      "function:0x00405900",
      "function:0x00405B90",
      "function:0x00405F80",
      "function:0x00406060",
      "function:0x004060C0",
      "function:0x00406250",
      "function:0x00406700",
      "function:0x00407450",
      "function:0x00407810",
      "function:0x004078A0",
      "function:0x0040A890",
      "function:0x0040CCE0",
      "function:0x00410980",
      "source:raw",
      "abi:lead"
    ]
  },
  "summary": "Reconstruction of generic runtime objects from 27 validated function IR records. The packet supplies one DERIVED owner (MutexSynchronizationObject for 0x00406700) and labels everything else UNKNOWN. Five audio functions (0x00405900, 0x00405B90, 0x00405F80, 0x00406060, 0x004060C0) share the same this-base fields (sample-info slot at +0x58, listener pointer at +0x54, loop/state flag at +0x14, behavior bitmask at +0x18, processor/filter state at +0x60/+0x64/+0x68) and are directly connected by call edges, so they are grouped as one DERIVED-proposed MilesSoundSourceObject. 0x00407D40 writes int/float triples into overlapping offsets (this+0x58..0x78) with a different interpretation and a different caller (0x004071F0), so it is kept as a separate AudioSampleDirectionObject and the offset overlap is recorded as an explicit contradiction. The three list-insert functions use the same 12-byte-node pattern but different list-field offsets and are kept as separate classes per rule 8. Free helpers (0x00405020, 0x004057E4, 0x00408210, 0x004084A0, 0x00408500) are assigned owner FreeFunction. State machinery is proposed for the per-frame scene-object loader and the collision-mode dispatcher; the Miles sample playback lazy-init is modeled as a first-call initialization pattern.",
  "function_roles": [
    {
      "address": "0x00403FC0",
      "role": "Reads one 28-byte entry from a 2D-indexed struct array (base this+0x158, second-dimension stride this+0x164, linear index = a2 + a3*stride), copies entry bytes 0..11 to a4 and 12..23 to a5, returns the second dword of the second group; consumed by the render-path callers 0x004C6F10 and 0x004D1140.",
      "owner": "IndexedStructArrayAccessor",
      "evidence_refs": [
        "function:0x00403FC0",
        "field:this:0x00000158",
        "field:this:0x00000164",
        "caller:0x004C6F10",
        "caller:0x004D1140",
        "source:raw"
      ]
    },
    {
      "address": "0x00405020",
      "role": "Thin wrapper: calls ComplexDestructorWith4LinkedLists with global unk_5EA440 (0x005EA440) as its argument and returns the result; the callee address and the purpose of the global are not established by the packet, so the init/load-path reading is unconfirmed.",
      "owner": "FreeFunction",
      "evidence_refs": [
        "function:0x00405020",
        "abi:lead",
        "global:0x005EA440",
        "source:raw"
      ]
    },
    {
      "address": "0x00405670",
      "role": "stdcall memory-copy helper: copies a3 bytes from a2 into a1 via an inline block copy and returns the one-past-the-end pointer a1+a3; invoked by MemoryAllocation_56a0 (0x004056A0) on the allocation/copy path.",
      "owner": "MemoryBlockCopyHelper",
      "evidence_refs": [
        "function:0x00405670",
        "abi:lead",
        "caller:0x004056A0",
        "source:raw"
      ]
    },
    {
      "address": "0x004057E4",
      "role": "__usercall helper with a custom register ABI: adds BYTE5(result) (bits 32..39 of the returned 64-bit value) into the byte at *a2, clears the byte at a3+112, returns result unchanged; the decompiler warns the stack may be mis-rendered.",
      "owner": "FreeFunction",
      "evidence_refs": [
        "function:0x004057E4",
        "abi:lead",
        "source:raw"
      ]
    },
    {
      "address": "0x004058D0",
      "role": "thiscall destructor: overwrites the vtable at this+0x0 with off_59E4B4, frees the child allocation at this+0x4 via FreeWrapper_7bcf when non-null, frees the object itself when deallocation flag bit 0 (a2 & 1) is set, returns this.",
      "owner": "VTableSwapDestructorObject",
      "evidence_refs": [
        "function:0x004058D0",
        "abi:lead",
        "global:0x0059E4B4",
        "field:this:0x00000000",
        "field:this:0x00000004",
        "callee:0x00587BCF",
        "guard:0",
        "source:raw"
      ]
    },
    {
      "address": "0x00405900",
      "role": "Lazy Miles sample-playback setup: aborts (return 1) when the collision/spatial response computation (0x00405E60) triggers; on first call (handle slot this+0x58 null) allocates a playback handle via 0x004070E0, stores a back-reference, and when the sample and file reference this+0x5C are valid sets the sample file, loop count (flag this+0x14: 1 = infinite -> 0, else 1), and passes this to sample-processor setup (0x004060C0); then writes position params and the active flag into the handle; a 3D request (a7 non-zero) applies the 3D update (0x00405B90) and clears the active flag; returns 0 on success, 1 on abort.",
      "owner": "MilesSoundSourceObject",
      "evidence_refs": [
        "function:0x00405900",
        "abi:lead",
        "callee:0x00405E60",
        "callee:0x004070E0",
        "callee:0x004060C0",
        "callee:0x00405B90",
        "field:this:0x00000058",
        "field:this:0x0000005C",
        "field:this:0x00000014",
        "field:this:0x00000060",
        "field:this:0x00000064",
        "field:this:0x00000068",
        "global:0x0059E3E0",
        "global:0x0059E3E8",
        "source:raw"
      ]
    },
    {
      "address": "0x00405B90",
      "role": "Per-frame 3D positional-audio recompute for one source vs a listener: distance attenuation (SmoothstepInterpolation 0x00406020 when bitmask bit 3 clear), stereo pan via ScaledDotProductWithClamp (0x00405F80) and DotProductWithScaleOffset (0x00406060), channel volumes and playback rate pushed through the Miles imports, then follow-up sample-state computation (0x00406100) and start/position/resume via 0x00587BDC; always returns 0; called by 0x00405900.",
      "owner": "MilesSoundSourceObject",
      "evidence_refs": [
        "function:0x00405B90",
        "abi:lead",
        "callee:0x00406020",
        "callee:0x00405F80",
        "callee:0x00406060",
        "callee:0x00406100",
        "callee:0x00587BDC",
        "field:this:0x00000018",
        "field:this:0x00000054",
        "field:this:0x00000028",
        "field:this:0x0000002C",
        "field:this:0x00000030",
        "field:this:0x00000014",
        "field:this:0x00000040",
        "field:this:0x00000044",
        "field:obj:0x0000001C",
        "global:0x0059E3B8",
        "global:0x0059E3BC",
        "global:0x0059E3C0",
        "global:0x0059E3C4",
        "global:0x0059E3D4",
        "global:0x008AAE70",
        "global:0x008AAE74",
        "caller:0x00405900",
        "source:raw"
      ]
    },
    {
      "address": "0x00405F80",
      "role": "Orientation-scaled attenuation factor: dot(a2, orientation sub-struct via this+0x54 at +0x7C/+0x80/+0x84) + 330.0 over dot(a2, listener-direction at this+0x34/+0x38/+0x3C) + 330.0, times current gain at this+0x48, clamped to [0.125, 8.0] and written back to this+0x48; called from 0x00405B90.",
      "owner": "MilesSoundSourceObject",
      "evidence_refs": [
        "function:0x00405F80",
        "abi:lead",
        "field:this:0x00000054",
        "field:this:0x00000034",
        "field:this:0x00000038",
        "field:this:0x0000003C",
        "field:this:0x00000048",
        "global:0x0059E4DC",
        "global:0x0059E4E0",
        "global:0x0059E4E4",
        "caller:0x00405B90",
        "source:raw"
      ]
    },
    {
      "address": "0x00406060",
      "role": "Pan/balance factor: dot of the stored vector (sub-struct via this+0x54, components at this+0xC4/+0xC8/+0xCC) against input a2, scaled and biased as (dot*0.60000002 + 1.0) * 0.5 into the [0.2, 0.8] range; used by 0x00405B90.",
      "owner": "MilesSoundSourceObject",
      "evidence_refs": [
        "function:0x00406060",
        "field:this:0x00000054",
        "field:this:0x000000C4",
        "field:this:0x000000C8",
        "field:this:0x000000CC",
        "caller:0x00405B90",
        "source:raw"
      ]
    },
    {
      "address": "0x004060C0",
      "role": "Miles sample processor/filter setup: loads sample-info from this+0x58, takes the Miles handle at its +0x10, calls AIL_set_sample_processor with this+0x64 as the processor value, and when the filter index this+0x60 is not -1 resolves it via sub_404FC0 and applies AIL_set_filter_sample_preference with this+0x68 as the filter data buffer; early-returns the null result when the sample-info or handle is null.",
      "owner": "MilesSoundSourceObject",
      "evidence_refs": [
        "function:0x004060C0",
        "abi:lead",